{
  "$schema": "https://json-schema.org/draft/2020-12/schema",
  "type": "object",
  "properties": {
    "preset": {
      "type": "string"
    },
    "disabled_agents": {
      "type": "array",
      "items": {
        "type": "string",
        "enum": [
          "orchestrator",
          "mastermind",
          "explorer",
          "librarian",
          "oracle",
          "designer",
          "fixer",
          "council",
          "councillor"
        ]
      }
    },
    "locale": {
      "default": "zh-TW",
      "type": "string",
      "enum": ["zh-TW", "en"]
    },
    "lessons": {
      "default": {
        "enabled": true,
        "path": "lessons.md",
        "readAtSessionStart": true,
        "promptAfterIdle": true
      },
      "type": "object",
      "properties": {
        "enabled": {
          "default": true,
          "type": "boolean"
        },
        "path": {
          "default": "lessons.md",
          "type": "string"
        },
        "readAtSessionStart": {
          "default": true,
          "type": "boolean"
        },
        "promptAfterIdle": {
          "default": true,
          "type": "boolean"
        }
      }
    },
    "planMode": {
      "default": {
        "enabled": true,
        "plansDir": ".opencode/plans",
        "minComplexity": "L3"
      },
      "type": "object",
      "properties": {
        "enabled": {
          "default": true,
          "type": "boolean"
        },
        "plansDir": {
          "default": ".opencode/plans",
          "type": "string"
        },
        "minComplexity": {
          "default": "L3",
          "type": "string",
          "enum": ["L1", "L2", "L3", "L4"]
        }
      }
    },
    "memoryMcp": {
      "default": {
        "enabled": true,
        "serverName": "codebase-memory-mcp",
        "remindAtTaskStart": true
      },
      "type": "object",
      "properties": {
        "enabled": {
          "default": true,
          "type": "boolean"
        },
        "serverName": {
          "default": "codebase-memory-mcp",
          "type": "string"
        },
        "remindAtTaskStart": {
          "default": true,
          "type": "boolean"
        }
      }
    },
    "errorRecovery": {
      "default": {
        "enabled": true,
        "minAttemptsBeforeEscalate": 3
      },
      "type": "object",
      "properties": {
        "enabled": {
          "default": true,
          "type": "boolean"
        },
        "minAttemptsBeforeEscalate": {
          "default": 3,
          "type": "integer",
          "minimum": 1,
          "maximum": 9007199254740991
        }
      }
    },
    "agents": {
      "type": "object",
      "propertyNames": {
        "type": "string"
      },
      "additionalProperties": {
        "type": "object",
        "properties": {
          "model": {
            "type": "string"
          },
          "variant": {
            "type": "string"
          },
          "temperature": {
            "type": "number",
            "minimum": 0,
            "maximum": 2
          },
          "skills": {
            "type": "array",
            "items": {
              "type": "string"
            }
          },
          "mcps": {
            "type": "array",
            "items": {
              "type": "string"
            }
          }
        }
      }
    },
    "presets": {
      "type": "object",
      "propertyNames": {
        "type": "string"
      },
      "additionalProperties": {
        "type": "object",
        "propertyNames": {
          "type": "string"
        },
        "additionalProperties": {
          "type": "object",
          "properties": {
            "model": {
              "type": "string"
            },
            "variant": {
              "type": "string"
            },
            "temperature": {
              "type": "number",
              "minimum": 0,
              "maximum": 2
            },
            "skills": {
              "type": "array",
              "items": {
                "type": "string"
              }
            },
            "mcps": {
              "type": "array",
              "items": {
                "type": "string"
              }
            }
          }
        }
      }
    },
    "sessionManager": {
      "type": "object",
      "properties": {
        "maxSessionsPerAgent": {
          "default": 2,
          "type": "integer",
          "minimum": 1,
          "maximum": 10
        },
        "readContextMinLines": {
          "default": 10,
          "type": "integer",
          "minimum": 0,
          "maximum": 1000
        },
        "readContextMaxFiles": {
          "default": 8,
          "type": "integer",
          "minimum": 0,
          "maximum": 50
        }
      }
    },
    "fallback": {
      "type": "object",
      "properties": {
        "retry_on_empty": {
          "default": true,
          "type": "boolean"
        }
      }
    },
    "council": {
      "type": "object",
      "properties": {
        "presets": {
          "type": "object",
          "propertyNames": {
            "type": "string"
          },
          "additionalProperties": {
            "type": "object",
            "propertyNames": {
              "type": "string"
            },
            "additionalProperties": {
              "type": "object",
              "propertyNames": {
                "type": "string"
              },
              "additionalProperties": {}
            }
          }
        },
        "timeout": {
          "default": 180000,
          "type": "number",
          "minimum": 0
        },
        "default_preset": {
          "default": "default",
          "type": "string"
        },
        "councillor_execution_mode": {
          "default": "parallel",
          "description": "Execution mode for councillors. \"serial\" runs them one at a time (required for single-model systems). \"parallel\" runs them concurrently (default, faster for multi-model systems).",
          "type": "string",
          "enum": ["parallel", "serial"]
        },
        "councillor_retries": {
          "default": 3,
          "description": "Number of retry attempts for councillors that return empty responses (e.g. due to provider rate limiting). Default: 3 retries.",
          "type": "integer",
          "minimum": 0,
          "maximum": 5
        },
        "master": {
          "description": "DEPRECATED — ignored. Council agent synthesizes directly."
        },
        "master_timeout": {
          "description": "DEPRECATED — ignored. Use \"timeout\" instead."
        },
        "master_fallback": {
          "description": "DEPRECATED — ignored. No separate master session."
        }
      },
      "required": ["presets"]
    }
  },
  "additionalProperties": false,
  "title": "opencode-agent-prime",
  "description": "Configuration schema for opencode-agent-prime OpenCode plugin"
}
